"x253810773","x1100857443519582208",2019-02-27 20:37:22,"drninashapiro","The 'herd' in herd immunity is crumbling. 
#VaccinesWork #measlesoutbreak #fluseason #FluShot #pertussis https://t.co/NQcVqLy9Lv","Twitter Web Client",104,,,,TRUE,FALSE,2,0,"VaccinesWork measlesoutbreak fluseason FluShot pertussis",,"twitter.com/forbeshealth/s…","https://t.co/NQcVqLy9Lv","https://twitter.com/forbeshealth/status/1100856785571926016",,,,,,,,,,,"en","x1100856785571926016","https://t.co/2fsUxHcdKo",2019-02-27 20:34:45,"Botstream-Health",1,0,"x47443693","forbeshealth","Forbes Health",84972,322,16533,"New York, NY","Covering the business of big pharma, health care and science from @Forbes.",TRUE,,,,,,,,,,,,,,,,,,,,,,"NA NA","NA NA","NA NA NA NA NA NA NA NA","https://twitter.com/drninashapiro/status/1100857443519582208","Dr. Nina L. Shapiro","Los Angeles, CA","HYPE @stmartinspress.  
Health contributor @forbes.  Professor, Ped ENT Mattel/UCLA #EatSAFE, #mothercutter #ilooklikeasurgeon.  Tweets are mine.","https://t.co/ojW8qC3Xd5",FALSE,6006,6002,186,10271,10618,2011-02-18 00:51:24,FALSE,"https://t.co/ojW8qC3Xd5","http://drninashapiro.com/hype","en","https://pbs.twimg.com/profile_banners/253810773/1518818582","http://abs.twimg.com/images/themes/theme16/bg.gif","http://pbs.twimg.com/profile_images/1437932825/Nina_Shapiro_M.D._184_5x100backcover_normal.jpg",-118.2436849,34.0522342
"x18391802","x1100840605951905792",2019-02-27 19:30:27,"drmarktrolice","The flu vaccine helps protect your pregnancy and your nursing baby. Find out more. #flushot #pregnancy #pregnancyhealth #healthypregnancy https://t.co/jJz6KatLbk https://t.co/k29KfqO2mO","AgoraPulse Manager",161,,,,FALSE,FALSE,4,0,"flushot pregnancy pregnancyhealth healthypregnancy",,"myfertilitycare.com/how-the-flu-va…","https://t.co/jJz6KatLbk","https://www.myfertilitycare.com/how-the-flu-vaccine-helps-protect-your-pregnancy-and-your-nursing-baby/","http://pbs.twimg.com/media/D0b4sTFVsAAL3Bf.jpg","https://t.co/k29KfqO2mO","https://twitter.com/drmarktrolice/status/1100840605951905792/photo/1","photo","http://pbs.twimg.com/media/D0b4sTFVsAAL3Bf.jpg","https://t.co/k29KfqO2mO","https://twitter.com/drmarktrolice/status/1100840605951905792/photo/1",,,,"en",,,,,,,,,,,,,,,,,,,,,,,,,,,,,,,,,,,,,"NA NA","NA NA","NA NA NA NA NA NA NA NA","https://twitter.com/drmarktrolice/status/1100840605951905792","Mark P. Trolice, MD","Orlando, FL","Infertility Specialist, Author, Speaker, Devoted2Family, Marathon Runner, Education = Empower #IVF #Surrogacy #Eggfreezing #Eggdonation https://t.co/c1kTkS8dMU","https://t.co/Q0dPAe4LUn",FALSE,1669,1052,40,5474,725,2008-12-26 17:18:51,FALSE,"https://t.co/Q0dPAe4LUn","http://www.TheIVFcenter.com","en","https://pbs.twimg.com/profile_banners/18391802/1550592274","http://abs.twimg.com/images/themes/theme18/bg.gif","http://pbs.twimg.com/profile_images/785911258394525696/pK9cMZ3a_normal.jpg",-81.3792365,28.5383355
"x542984753","x1100824386523840513",2019-02-27 18:26:00,"Karenamoores","Thankful for my #flushot. Winter ailments like today's could be a lot worse. 
And thanks for your ongoing advocacy to keep the little ones we love and their adults safe, @jillpromoli.","Twitter Web Client",183,,,,FALSE,FALSE,3,0,"flushot",,,,,,,,,,,,,"x32871593","jillpromoli","en",,,,,,,,,,,,,,,,,,,,,,,,,,,,,,,,,,,,,"NA NA","NA NA","NA NA NA NA NA NA NA NA","https://twitter.com/Karenamoores/status/1100824386523840513","Karen Moores","Canada","Lover of a good story, big skies, bigger seas + extreme seasons. Proudest Auntie and dog owner. Believer in the power of Canadian entrepreneurs.",,FALSE,2666,1388,98,30689,46344,2012-04-02 00:58:01,FALSE,,,"en","https://pbs.twimg.com/profile_banners/542984753/1547959586","http://abs.twimg.com/images/themes/theme9/bg.gif","http://pbs.twimg.com/profile_images/738802426614976512/Fle9NfXc_normal.jpg",-106.346771,56.130366
"x849811413501583360","x1100820502715613184",2019-02-27 18:10:34,"MT_Headed406","Here's to 22 years of not getting a #FluShot.  It is weird I know tons of people that get flu shots religiously, and end up with the flu.  I don't recall the last time I had it. #VaccinesWork ?","Twitter for Android",193,,,,FALSE,FALSE,3,0,"FluShot VaccinesWork",,,,,,,,,,,,,,,"en",,,,,,,,,,,,,,,,,,,,,,,,,,,,,,,,,,,,,"NA NA","NA NA","NA NA NA NA NA NA NA NA","https://twitter.com/MT_Headed406/status/1100820502715613184","Axel Wolf <U+0001F468><U+0001F43B><U+0001F416> (manBEARpig )","Washington, USA","Maximum Freedom",,FALSE,108,80,0,600,680,2017-04-06 02:30:04,FALSE,,,"en","https://pbs.twimg.com/profile_banners/849811413501583360/1491446153",,"http://pbs.twimg.com/profile_images/849812884448174080/1tegmCmp_normal.jpg",-120.7401385,47.7510741
"x372491544","x1100802804686434305",2019-02-27 17:00:15,"TuSNHD","¡Visite la biblioteca Clark County recoja su libro favorito y póngase las #vacunas que necesite! 1401 E. Flamingo! Nuestra clínica móvil estará hoy de 10a-1p https://t.co/K0YE3dFk8m @LVCCLD #flushot #immunization https://t.co/vPGo6SuiVf","Buffer",212,,,,FALSE,FALSE,1,1,"vacunas flushot immunization",,"j.mp/2DbgixA","https://t.co/K0YE3dFk8m","http://j.mp/2DbgixA","http://pbs.twimg.com/media/D0bWUOdWoAAKLNI.jpg","https://t.co/vPGo6SuiVf","https://twitter.com/TuSNHD/status/1100802804686434305/photo/1","photo","http://pbs.twimg.com/media/D0bWUOdWoAAKLNI.jpg","https://t.co/vPGo6SuiVf","https://twitter.com/TuSNHD/status/1100802804686434305/photo/1",,"x14245002","LVCCLD","es",,,,,,,,,,,,,,,,,,,,,,,,,,,,,,,,,,,,,"NA NA","NA NA","NA NA NA NA NA NA NA NA","https://twitter.com/TuSNHD/status/1100802804686434305","TuSNHD","Las Vegas, Nevada","Para proteger y  promover la salud, el medio ambiente y el bienestar de los residentes y visitantes del Sur de Nevada","http://t.co/Beyh6PjJP9",FALSE,251,242,16,10977,20,2011-09-12 21:37:13,FALSE,"http://t.co/Beyh6PjJP9","http://www.southernnevadahealthdistrict.org","en","https://pbs.twimg.com/profile_banners/372491544/1357319662","http://abs.twimg.com/images/themes/theme8/bg.gif","http://pbs.twimg.com/profile_images/1540266683/SNHD-Espanol-Twitter_normal.jpg",-115.1398296,36.1699412
"x372491544","x1100804765917872128",2019-02-27 17:08:02,"TuSNHD","Pick up a good book and get your #immunizations at Clark County Library 1401 E. Flamingo! Our Mobile Clinic is on site 10a-1p today. https://t.co/K0YE3dFk8m @LVCCLD #publichealth #immunization #BacktoSchool #flushot https://t.co/8oYbmdKPQz","Buffer",215,,,,FALSE,FALSE,0,0,"immunizations publichealth immunization BacktoSchool flushot",,"j.mp/2DbgixA","https://t.co/K0YE3dFk8m","http://j.mp/2DbgixA","http://pbs.twimg.com/media/D0bYGYyXgAA9f5U.jpg","https://t.co/8oYbmdKPQz","https://twitter.com/TuSNHD/status/1100804765917872128/photo/1","photo","http://pbs.twimg.com/media/D0bYGYyXgAA9f5U.jpg","https://t.co/8oYbmdKPQz","https://twitter.com/TuSNHD/status/1100804765917872128/photo/1",,"x14245002","LVCCLD","en",,,,,,,,,,,,,,,,,,,,,,,,,,,,,,,,,,,,,"NA NA","NA NA","NA NA NA NA NA NA NA NA","https://twitter.com/TuSNHD/status/1100804765917872128","TuSNHD","Las Vegas, Nevada","Para proteger y  promover la salud, el medio ambiente y el bienestar de los residentes y visitantes del Sur de Nevada","http://t.co/Beyh6PjJP9",FALSE,251,242,16,10977,20,2011-09-12 21:37:13,FALSE,"http://t.co/Beyh6PjJP9","http://www.southernnevadahealthdistrict.org","en","https://pbs.twimg.com/profile_banners/372491544/1357319662","http://abs.twimg.com/images/themes/theme8/bg.gif","http://pbs.twimg.com/profile_images/1540266683/SNHD-Espanol-Twitter_normal.jpg",-115.1398296,36.1699412
"x1270781","x1100797063229431809",2019-02-27 16:37:26,"jarin","#FluShot","Twitter for iPhone",8,,,,FALSE,FALSE,0,0,"FluShot",,,,,,,,,,,,,,,"und",,,,,,,,,,,,,,,,,,,,,,,,,,,,,,,"https://api.twitter.com/1.1/geo/id/a592bd6ceb1319f7.json","San Diego","San Diego, CA","city","United States","US","NA NA","NA NA","-117.282538 -116.9274403 -116.9274403 -117.282538 32.53962 32.53962 33.0804044 33.0804044","https://twitter.com/jarin/status/1100797063229431809","Jarin Udom","San Diego, CA","Programmer, cybersecurity engineer, nerd, dirty socialist, and hard drinker. My viewpoints are not the viewpoints of my employer or any rational person.",,FALSE,1211,2286,69,443,18355,2007-03-16 06:57:56,FALSE,,,"en","https://pbs.twimg.com/profile_banners/1270781/1525827970","http://abs.twimg.com/images/themes/theme9/bg.gif","http://pbs.twimg.com/profile_images/994020967562199040/XoL3sgEY_normal.jpg",-117.1610838,32.715738
"x3002118118","x1100793597539037188",2019-02-27 16:23:40,"RepSanfelippo","It's still not too late to get your #flushot to protect yourself and others from the spread of the influenza virus. https://t.co/Nr47u3kFQi","Twitter Web Client",115,,,,TRUE,FALSE,0,0,"flushot",,"twitter.com/DHSWI/status/1…","https://t.co/Nr47u3kFQi","https://twitter.com/DHSWI/status/1100786384288108544",,,,,,,,,,,"en","x1100786384288108544","Think the flu season is over? Think again! But it's not too late to protect yourself &amp; everyone around you from serious illness. Get a flu shot. Find where the shot is available near you at https://t.co/FkvJsQwTR3 @CDCFlu
#FightFlu https://t.co/wMJlfWXy7t",2019-02-27 15:55:00,"TweetDeck",0,0,"x293028988","DHSWI","WIDeptHealthServices",2808,256,6590,"Wisconsin, USA","The Official Twitter Account for the Wisconsin Department of Health Services -- Visit us online at:",FALSE,,,,,,,,,,,,,,,,,,,,,,"NA NA","NA NA","NA NA NA NA NA NA NA NA","https://twitter.com/RepSanfelippo/status/1100793597539037188","Joe Sanfelippo","New Berlin, WI","Official Twitter profile of Wisconsin State Representative Joe Sanfelippo, proudly representing WI's 15th Assembly District","http://t.co/qJDtJXztH5",FALSE,1476,1002,59,3077,736,2015-01-27 21:16:47,FALSE,"http://t.co/qJDtJXztH5","http://legis.wisconsin.gov/assembly/sanfelippo/Pages/default.aspx","en","https://pbs.twimg.com/profile_banners/3002118118/1457538563","http://abs.twimg.com/images/themes/theme1/bg.png","http://pbs.twimg.com/profile_images/679684451102769152/xiERbmtz_normal.jpg",-88.1084224,42.9764027
"x291951344","x1099763428795867136",2019-02-24 20:10:08,"FindLawConsumer","When It's Too Late to Get a #FluShot
https://t.co/1NjaMhoaff","Hootsuite Inc.",60,,,,FALSE,FALSE,1,2,"FluShot",,"ow.ly/ZBxd30nNXKW","https://t.co/1NjaMhoaff","http://ow.ly/ZBxd30nNXKW",,,,,,,,,,,"en",,,,,,,,,,,,,,,,,,,,,,,,,,,,,,,,,,,,,"NA NA","NA NA","NA NA NA NA NA NA NA NA","https://twitter.com/FindLawConsumer/status/1099763428795867136","FindLaw Consumers","San Jose, CA","FindLaw for Consumers is making the law easy to access, tweeting interesting, entertaining and informative legal news! Our newsletters: https://t.co/zMdaKMby4e","http://t.co/tQepUdPBo7",FALSE,18509,1075,518,43808,719,2011-05-02 21:42:22,TRUE,"http://t.co/tQepUdPBo7","http://www.findlaw.com/","en","https://pbs.twimg.com/profile_banners/291951344/1537891817","http://abs.twimg.com/images/themes/theme1/bg.png","http://pbs.twimg.com/profile_images/1046845738603270144/ue2vVJUd_normal.jpg",-121.8863286,37.3382082
"x291951344","x1100788012282249216",2019-02-27 16:01:28,"FindLawConsumer","When It's Too Late to Get a #FluShot https://t.co/z5Mo29xQzS","Hootsuite Inc.",60,,,,FALSE,FALSE,0,1,"FluShot",,"ow.ly/SdxO30nNXOY","https://t.co/z5Mo29xQzS","http://ow.ly/SdxO30nNXOY",,,,,,,,,,,"en",,,,,,,,,,,,,,,,,,,,,,,,,,,,,,,,,,,,,"NA NA","NA NA","NA NA NA NA NA NA NA NA","https://twitter.com/FindLawConsumer/status/1100788012282249216","FindLaw Consumers","San Jose, CA","FindLaw for Consumers is making the law easy to access, tweeting interesting, entertaining and informative legal news! Our newsletters: https://t.co/zMdaKMby4e","http://t.co/tQepUdPBo7",FALSE,18509,1075,518,43808,719,2011-05-02 21:42:22,TRUE,"http://t.co/tQepUdPBo7","http://www.findlaw.com/","en","https://pbs.twimg.com/profile_banners/291951344/1537891817","http://abs.twimg.com/images/themes/theme1/bg.png","http://pbs.twimg.com/profile_images/1046845738603270144/ue2vVJUd_normal.jpg",-121.8863286,37.3382082
"x1000905301187481601","x1100787882007187457",2019-02-27 16:00:57,"ClovisCare","Protect your family and friends this winter. 
https://t.co/yERQlYiEoz 
…..
#Clovis #Fresno #ClovisUrgentCare #FresnoUrgentCare #CentralValley #559 #CSUFresno #FresnoDoctor #ClovisDoctor #MedicalCenter #WalkInClinic #UrgentCare #FluNews #Flu #FluSeason #FluShot #Sick https://t.co/TVMJa0HRfG","eClincher",266,,,,FALSE,FALSE,0,0,"Clovis Fresno ClovisUrgentCare FresnoUrgentCare CentralValley CSUFresno FresnoDoctor ClovisDoctor MedicalCenter WalkInClinic UrgentCare FluNews Flu FluSeason FluShot Sick",,"bit.ly/Clovis_Urgent_…","https://t.co/yERQlYiEoz","http://bit.ly/Clovis_Urgent_Care","http://pbs.twimg.com/media/D0bIvpyXgAYkd7z.png","https://t.co/TVMJa0HRfG","https://twitter.com/ClovisCare/status/1100787882007187457/photo/1","photo","http://pbs.twimg.com/media/D0bIvpyXgAYkd7z.png","https://t.co/TVMJa0HRfG","https://twitter.com/ClovisCare/status/1100787882007187457/photo/1",,,,"en",,,,,,,,,,,,,,,,,,,,,,,,,,,,,,,,,,,,,"NA NA","NA NA","NA NA NA NA NA NA NA NA","https://twitter.com/ClovisCare/status/1100787882007187457","Clovis Urgent Care","Clovis","Founded in 1983, Clovis Urgent Care is committed to providing the highest quality healthcare for residents of and visitors to the Clovis and Fresno communities.","https://t.co/ppcFHL26om",FALSE,113,741,1,111,1284,2018-05-28 01:03:14,FALSE,"https://t.co/ppcFHL26om","http://clovisurgentcare.com/","en","https://pbs.twimg.com/profile_banners/1000905301187481601/1528263375","http://abs.twimg.com/images/themes/theme1/bg.png","http://pbs.twimg.com/profile_images/1000906163934842881/b7fMdbJm_normal.jpg",-103.2052272,34.4047987
"x916331911366180866","x1100770095285063680",2019-02-27 14:50:16,"UR_RPRC","Will Your #FluShot Weaken as #FluSeason Drags On? Read what Ann Falsey, MD had to say - https://t.co/XvyfwtiW1G","Twitter Web Client",111,,,,FALSE,FALSE,0,0,"FluShot FluSeason",,"webmd.com/cold-and-flu/n…","https://t.co/XvyfwtiW1G","https://www.webmd.com/cold-and-flu/news/20190225/will-your-flu-shot-weaken-as-flu-season-drags-on",,,,,,,,,,,"en",,,,,,,,,,,,,,,,,,,,,,,,,,,,,,,,,,,,,"NA NA","NA NA","NA NA NA NA NA NA NA NA","https://twitter.com/UR_RPRC/status/1100770095285063680","UR RPRC","Rochester, NY","RPRC consists of a national network of scientists focused on research that will lead to important changes in the treatment & prevention of respiratory pathogens","https://t.co/mxVsdw5sv6",FALSE,25,85,1,53,0,2017-10-06 15:58:47,FALSE,"https://t.co/mxVsdw5sv6","https://www.urmc.rochester.edu/respiratory-pathogens-research-center.aspx","en","https://pbs.twimg.com/profile_banners/916331911366180866/1508851157","http://abs.twimg.com/images/themes/theme1/bg.png","http://pbs.twimg.com/profile_images/922819136446705664/Osjpsc3p_normal.jpg",-77.6088465,43.1565779
"x31525154","x1100764089394085888",2019-02-27 14:26:24,"thejoyofsaving","#FluShot","Twitter for iPhone",8,,,,FALSE,FALSE,0,0,"FluShot",,,,,,,,,,,,,,,"und",,,,,,,,,,,,,,,,,,,,,,,,,,,,,,,,,,,,,"NA NA","NA NA","NA NA NA NA NA NA NA NA","https://twitter.com/thejoyofsaving/status/1100764089394085888","Joy","Florida, USA","I <U+2665> contests, coupons, computer games, console games, crafts, & cats! =^..^=","http://thejoyofsavingmoney.com",FALSE,3391,4837,25,15400,310,2009-04-15 21:23:51,FALSE,"http://thejoyofsavingmoney.com",,"en","https://pbs.twimg.com/profile_banners/31525154/1449189936","http://abs.twimg.com/images/themes/theme10/bg.gif","http://pbs.twimg.com/profile_images/672576758365974529/qqDkl6h2_normal.jpg",-81.5157535,27.6648274
"x323869695","x1100755113357004800",2019-02-27 13:50:44,"drfixus","#VaxFactsFebruary d27! According to @CDCgov flu has killed upwards of 13,600 ppl in the US THIS SEASON. 41 children have died so far. Get a #FluShot for yourself and your kids. It can’t give you the flu. It’s very safe. It saves lives. 
Go. 
Now. https://t.co/2fv6MJXzna","Twitter for iPhone",246,,,,FALSE,FALSE,8,2,"VaxFactsFebruary FluShot",,,,,"http://pbs.twimg.com/tweet_video_thumb/D0aq7pUXgAIQ8WB.jpg","https://t.co/2fv6MJXzna","https://twitter.com/drfixus/status/1100755113357004800/photo/1","photo","http://pbs.twimg.com/tweet_video_thumb/D0aq7pUXgAIQ8WB.jpg","https://t.co/2fv6MJXzna","https://twitter.com/drfixus/status/1100755113357004800/photo/1",,"x146569971","CDCgov","en",,,,,,,,,,,,,,,,,,,,,,,,,,,,,,,,,,,,,"NA NA","NA NA","NA NA NA NA NA NA NA NA","https://twitter.com/drfixus/status/1100755113357004800","DrFixus","United States","Pediatrician in public health. Unabashedly pro-kid. Weary of deniers of science. Breast CA survivor. #VaccinesSaveLives Tweets and snark are mine alone.",,FALSE,1004,492,18,5223,15779,2011-06-25 15:37:13,FALSE,,,"en",,"http://abs.twimg.com/images/themes/theme18/bg.gif","http://pbs.twimg.com/profile_images/762256369734955008/Zv1JdDZp_normal.png",-95.712891,37.09024
"x323869695","x1100755769157390337",2019-02-27 13:53:21,"drfixus","I’m going to use a gif of Jim Carrey to tell you to go get a #flushot because that would completely annoy him. Which seems totally fair IMHO. 
Are you listening???? 
#GetVaxxed #FlightFlu
#VaccinateYourKids #VaccinesSaveLives https://t.co/Ujn0SIM4re","Twitter for iPhone",225,,,,FALSE,FALSE,8,2,"flushot GetVaxxed FlightFlu VaccinateYourKids VaccinesSaveLives",,,,,"http://pbs.twimg.com/tweet_video_thumb/D0ariGkW0AAmuGv.jpg","https://t.co/Ujn0SIM4re","https://twitter.com/drfixus/status/1100755769157390337/photo/1","photo","http://pbs.twimg.com/tweet_video_thumb/D0ariGkW0AAmuGv.jpg","https://t.co/Ujn0SIM4re","https://twitter.com/drfixus/status/1100755769157390337/photo/1",,,,"en",,,,,,,,,,,,,,,,,,,,,,,,,,,,,,,,,,,,,"NA NA","NA NA","NA NA NA NA NA NA NA NA","https://twitter.com/drfixus/status/1100755769157390337","DrFixus","United States","Pediatrician in public health. Unabashedly pro-kid. Weary of deniers of science. Breast CA survivor. #VaccinesSaveLives Tweets and snark are mine alone.",,FALSE,1004,492,18,5223,15779,2011-06-25 15:37:13,FALSE,,,"en",,"http://abs.twimg.com/images/themes/theme18/bg.gif","http://pbs.twimg.com/profile_images/762256369734955008/Zv1JdDZp_normal.png",-95.712891,37.09024
"x323869695","x1099693335327973376",2019-02-24 15:31:37,"drfixus","#VaxFactsFebruary d24! Black children are significantly less likely to receive a #FluShot than white children. Flu vaccine reduces pediatric flu-associated deaths by &gt;50%. Of 291 Peds deaths with known immunization status, 74% were unvaccinated. <U+2B06><U+FE0F> vax = <U+2B07><U+FE0F> death. #FightFlu","Twitter for iPhone",277,,,,FALSE,FALSE,12,8,"VaxFactsFebruary FluShot FightFlu",,,,,,,,,,,,,,,"en",,,,,,,,,,,,,,,,,,,,,,,,,,,,,,,,,,,,,"NA NA","NA NA","NA NA NA NA NA NA NA NA","https://twitter.com/drfixus/status/1099693335327973376","DrFixus","United States","Pediatrician in public health. Unabashedly pro-kid. Weary of deniers of science. Breast CA survivor. #VaccinesSaveLives Tweets and snark are mine alone.",,FALSE,1004,492,18,5223,15779,2011-06-25 15:37:13,FALSE,,,"en",,"http://abs.twimg.com/images/themes/theme18/bg.gif","http://pbs.twimg.com/profile_images/762256369734955008/Zv1JdDZp_normal.png",-95.712891,37.09024
"x14533871","x1100747763053150208",2019-02-27 13:21:32,"singhav8r","What’s the best argument for someone who gets all shots EXCEPT the flu shot? Like what would convince them? #FluShot #antivaxxers","Twitter for iPhone",129,,,,FALSE,FALSE,2,0,"FluShot antivaxxers",,,,,,,,,,,,,,,"en",,,,,,,,,,,,,,,,,,,,,,,,,,,,,,,"https://api.twitter.com/1.1/geo/id/38d5974e82ed1a6c.json","Ottawa","Ottawa, Ontario","city","Canada","CA","NA NA","NA NA","-76.353876 -75.246407 -75.246407 -76.353876 44.961937 44.961937 45.5356446 45.5356446","https://twitter.com/singhav8r/status/1100747763053150208","Manu Singh","Ontario, Canada","New (and likely most talkative) member of the amazing #Digital #Design and #Production #Team @CanRevAgency. I also enjoy #NanaimoBars, #ElectricCars and #METARs",,FALSE,557,448,20,2070,3481,2008-04-25 20:39:54,FALSE,,,"en","https://pbs.twimg.com/profile_banners/14533871/1539946861","http://abs.twimg.com/images/themes/theme4/bg.gif","http://pbs.twimg.com/profile_images/1053239586892193792/BkI63tSt_normal.jpg",-85.323214,51.253775
"x417476424","x1100687937249964032",2019-02-27 09:23:48,"ThomasLandis1","#FluShot","Twitter Web App",8,,,,FALSE,FALSE,0,0,"FluShot",,,,,,,,,,,,,,,"und",,,,,,,,,,,,,,,,,,,,,,,,,,,,,,,,,,,,,"NA NA","NA NA","NA NA NA NA NA NA NA NA","https://twitter.com/ThomasLandis1/status/1100687937249964032","Thomas Landis","Philadelphia","Lawyer-Criminal defense , Family law. 
267-776-3005","https://t.co/hc1cRfgFTO",FALSE,71,252,0,478,464,2011-11-21 00:20:07,FALSE,"https://t.co/hc1cRfgFTO","http://www.tomlandislaw.biz","en",,"http://abs.twimg.com/images/themes/theme18/bg.gif","http://abs.twimg.com/sticky/default_profile_images/default_profile_normal.png",-75.1652215,39.9525839
"x16726509","x1099909360921337856",2019-02-25 05:50:01,"ihealthtube","Flu Shot Warning! Watch This Before Getting One!  https://t.co/TlaYETnn8h
#flushot #flu #fluvaccine #vaccine #vaccines https://t.co/ykHowCau0N","Buffer",118,,,,FALSE,FALSE,0,0,"flushot flu fluvaccine vaccine vaccines",,"buff.ly/2ynmaqy","https://t.co/TlaYETnn8h","https://buff.ly/2ynmaqy","http://pbs.twimg.com/media/D0OpvCHX0AAMeOq.jpg","https://t.co/ykHowCau0N","https://twitter.com/ihealthtube/status/1099909360921337856/photo/1","photo","http://pbs.twimg.com/media/D0OpvCHX0AAMeOq.jpg","https://t.co/ykHowCau0N","https://twitter.com/ihealthtube/status/1099909360921337856/photo/1",,,,"en",,,,,,,,,,,,,,,,,,,,,,,,,,,,,,,,,,,,,"NA NA","NA NA","NA NA NA NA NA NA NA NA","https://twitter.com/ihealthtube/status/1099909360921337856","iHealthTube.com","United States","Natural Health Videos! Avoid Prescriptions. Avoid Toxins. Eat Organic. Find natural remedies to your health problems. Visit the Site! http://t.co/6wybx3mTAH","http://t.co/6wybx3mTAH",FALSE,10434,7060,282,25606,19,2008-10-13 20:01:02,FALSE,"http://t.co/6wybx3mTAH","http://www.ihealthtube.com","en",,"http://abs.twimg.com/images/themes/theme2/bg.gif","http://pbs.twimg.com/profile_images/67860916/Picture_4_11-05-36_normal.png",-95.712891,37.09024
"x16726509","x1100653765735141376",2019-02-27 07:08:01,"ihealthtube","You'll Be Shocked at What the Flu Shot is Really Doing to You!  https://t.co/QjfvV1HB4n
#flushot #fluvaccine #flu #vaccines #VaccineInjury https://t.co/7NxmT7Zrhb","Buffer",138,,,,FALSE,FALSE,0,0,"flushot fluvaccine flu vaccines VaccineInjury",,"buff.ly/2UuleHD","https://t.co/QjfvV1HB4n","https://buff.ly/2UuleHD","http://pbs.twimg.com/media/D0ZOxGDX0AAsqE-.jpg","https://t.co/7NxmT7Zrhb","https://twitter.com/ihealthtube/status/1100653765735141376/photo/1","photo","http://pbs.twimg.com/media/D0ZOxGDX0AAsqE-.jpg","https://t.co/7NxmT7Zrhb","https://twitter.com/ihealthtube/status/1100653765735141376/photo/1",,,,"en",,,,,,,,,,,,,,,,,,,,,,,,,,,,,,,,,,,,,"NA NA","NA NA","NA NA NA NA NA NA NA NA","https://twitter.com/ihealthtube/status/1100653765735141376","iHealthTube.com","United States","Natural Health Videos! Avoid Prescriptions. Avoid Toxins. Eat Organic. Find natural remedies to your health problems. Visit the Site! http://t.co/6wybx3mTAH","http://t.co/6wybx3mTAH",FALSE,10434,7060,282,25606,19,2008-10-13 20:01:02,FALSE,"http://t.co/6wybx3mTAH","http://www.ihealthtube.com","en",,"http://abs.twimg.com/images/themes/theme2/bg.gif","http://pbs.twimg.com/profile_images/67860916/Picture_4_11-05-36_normal.png",-95.712891,37.09024
"x26681376","x1100643605679693824",2019-02-27 06:27:39,"SusanMahne","#FluShot","Twitter for iPad",8,,,,FALSE,FALSE,0,0,"FluShot",,,,,,,,,,,,,,,"und",,,,,,,,,,,,,,,,,,,,,,,,,,,,,,,,,,,,,"NA NA","NA NA","NA NA NA NA NA NA NA NA","https://twitter.com/SusanMahne/status/1100643605679693824","Susan Mahne","Tucson Arizona","All things NASCAR ! Denver Broncos! New York Yankees !",,FALSE,59,102,0,4025,2375,2009-03-26 03:43:03,FALSE,,,"en","https://pbs.twimg.com/profile_banners/26681376/1544930116","http://abs.twimg.com/images/themes/theme1/bg.png","http://pbs.twimg.com/profile_images/1097016953321840640/XcGOSf0K_normal.jpg",-110.9747108,32.2226066
"x1594039950","x1100633762566717440",2019-02-27 05:48:32,"lilhwn2","#FluShot","Twitter for iPhone",8,,,,FALSE,FALSE,1,0,"FluShot",,,,,,,,,,,,,,,"und",,,,,,,,,,,,,,,,,,,,,,,,,,,,,,,,,,,,,"NA NA","NA NA","NA NA NA NA NA NA NA NA","https://twitter.com/lilhwn2/status/1100633762566717440","A. Chung","Mobile, AL","Pediatrics is my passion, teaching is in my soul. Pediatric Clinical Pharmacist, Associate Professor for @AUHSOP. Hawaii born/raised. #PICUPharm #PedsPharm",,FALSE,258,767,3,7833,9296,2013-07-14 19:10:32,FALSE,,,"en",,"http://abs.twimg.com/images/themes/theme1/bg.png","http://pbs.twimg.com/profile_images/1097557676458946561/xu3IrHRt_normal.jpg",-88.0398912,30.6953657
"x1801473188","x1100613147495411713",2019-02-27 04:26:37,"QueenBBelle","#FluShot","Twitter for Android",8,,,,FALSE,FALSE,0,0,"FluShot",,,,,,,,,,,,,,,"und",,,,,,,,,,,,,,,,,,,,,,,,,,,,,,,"https://api.twitter.com/1.1/geo/id/4233ec320eb73634.json","Cedar Hill","Cedar Hill, TX","city","United States","US","NA NA","NA NA","-97.028288 -96.891039 -96.891039 -97.028288 32.541286 32.541286 32.649242 32.649242","https://twitter.com/QueenBBelle/status/1100613147495411713","Belle Hopper","","My loves are my children, my babe, Spurs, Cowboys, Rangers, Texas Longhorns & cooking, oh and of course getting pampered.",,FALSE,276,2081,5,7616,7372,2013-09-08 04:32:53,FALSE,,,"en","https://pbs.twimg.com/profile_banners/1801473188/1489204790","http://abs.twimg.com/images/themes/theme1/bg.png","http://pbs.twimg.com/profile_images/378800000427369181/27c4c721b7bb54ce479168b7fd026df9_normal.jpeg",,
